ID,Title,Location,Salary,Summary
https://kr.indeed.com/viewjob?jk=d11342cfe074df78,Frontend Developer (Javascript/React),Bepro Company 서울,"연봉 30,000,000원 - 80,000,000원",참고 - React JS (Web) / Kotlin (Android) / Swift (iOS) - Python + Django - AWS lambda + API gateway - MySQL - Google Cloud...
https://kr.indeed.com/viewjob?jk=9ad46a78c31b7eaf,2017년도 제3차 계약직 연구원 공개채용 공고,대구경북과학기술원 대구 현풍면,,"연구 생체 신호 및 영상정보 획득 및 관리, 분석 우대 사항 Python 기반 객체지향 소프트웨어 개발 관련 연구 수행 경험자 생체신호... learning) 알고리즘 개발 Python/Tensorflow 프로그..."
https://kr.indeed.com/viewjob?jk=8a15326f80e07c08,Customer Operations Engineering Manager,Success Korea 대한민국,,experience in C++ or Java and Python - Network monitoring and application... C++ or Java and Python - Network...
https://kr.indeed.com/viewjob?jk=87b8f255f1402269,"빅데이터, IoT 활용 무료교육 연수생",한국산업기술협회 서울 금천구,,"스마트융합전문가 양성과정 - 스마트공장 현장제어 기본 - Java, Python 기본 프로그래밍 및 실습 - 데이터베이스 기본 - 파이썬 기반 센싱데... 게임>빅데이터·AI(인공지능)> Python|인터넷·IT·통신·모바일·게임..."
https://kr.indeed.com/viewjob?jk=4484523b503e0f07,Chief Technology Officer,Asiance 서울,,"mainly. • 배포는 주로 Docker 사용. • Python, Node.js, Java, PHP for backend development. • Python, Node.js, Java, PHP 등을 사용하여 백엔드 개발..."
https://kr.indeed.com/viewjob?jk=94bf3c1c1c64fc87,[정보보안] 보안분석 플랫폼 개발 및 운영 담당자,한국카카오은행 성남 분당구,,"분 · Java, Golang, Python 등으로 오픈소스를 활용한 개발... 모바일·게임>웹프로그래머>JAVA|인터넷·IT·통신·모바일·게임>웹프로그래머> Python|인터넷·IT·통신·모바일·게임>응용프로그래머> Python"
https://kr.indeed.com/viewjob?jk=374a2050c03724fe,2020-1회 인지 및 사회성 연구단 인지 교세포과학 그룹 박사후연구원,기초과학연구원 대전,,"정자 - 전공 : 인지신경과학, 뇌공학, 심리학, 통계학, 전기전자컴퓨터공학 - 우대사항 : Matlab, Python, Unity3D 등 프로그래밍 및 데이터 분석 유경험자 ㅇ 인원 : 1명 [응시자격 공통] - 국가공무원..."
https://kr.indeed.com/viewjob?jk=af96fe64997f8ef3,주요정보통신기반시설 취약점진단분석평가 전문가(경력),한국정보기술단 과천 과천시,,"자격요건] - 3년 이상 취약점분석평가 업무 경험자 - Shell, batch, Excel, VBA, Python 프로그램 개발 가능자 - 분석평가보고서, 제안서 작성 숙달자 - 기반보호법, 정보통신망법, 개인정보보호법 숙지..."
https://kr.indeed.com/viewjob?jk=dea246efe3aa55a7,[AI검색플랫폼] 머신러닝 개발자,카카오엔터프라이즈 성남 분당구,,분 (Java/ Python 선호) ・ (우대) 머신러닝 관련 업무 유경험자 ・ (우대) NMT 관련 업무 유경험자 ✔ 지식그래프 품질 및 관련 연구 ・ (필수) 하나 이상의 능숙한 프로그래밍 언어가 있으신 분 ( Python...
https://kr.indeed.com/viewjob?jk=241ae1e7499c461c,Security Engineer (모의해킹/취약점 점검),Toss 서울 강남구,,"그바운트 경험이 있는 분 - 해킹대회 우승 경력이 있는 분 - 다양한 플랫폼 보안 진단 경험이 있는 분 - Python, C, C++, C#, JAVA 중 프로그래밍 언어에 능숙 하신 분 # 현업 인터뷰 - 결제 산업의 미래..."
https://kr.indeed.com/viewjob?jk=694ab958318e7fdc,RTL 및 ASIC 설계 엔지니어(딥러닝 하드웨어 프로세서 개발),딥엑스 성남 분당구,"연봉 40,000,000원 - 99,990,000원","모델의 RTL IP 설계 및 IP 검증 가능자 - Language: Python/Perl, C/C++ [우대 조건] - ARM based SoC 설계... 게임>빅데이터·AI(인공지능)> Python|인터넷·IT·통신·모바일·게임..."
https://kr.indeed.com/viewjob?jk=713deb15cc6428fd,[NAVERxLINE] Global Ad Data Engineer/Dat...,네이버 서울,,"광고 퍼포먼스에 대한 Reliablity Engineering [자격요건 ] - Java, Scala, Python 등의 언어를 활용한 소프트웨어 개발 역량 - 리눅스 환경에서의 시스템 개발 및 운영 경험 - 분산 환경에서의..."
https://kr.indeed.com/viewjob?jk=ed3686b9c2eea9ad,"Principal, Data Engineer (Pricing Tech)",Coupang 3.1 서울,,"링하고 알림을 주는 시스템을 구축한다. 자격 요건: 컴퓨터 공학 혹은 관련 전공 수료자 Java, Python, Unix shell, html 프로그래밍 가능자 10년 이상 웹서비스 및 백엔드 개발을 하신 분 – 데이..."
https://kr.indeed.com/viewjob?jk=c1037225077ca4da,데이터 분석가 (Business Intelligence Analyst),코스닥 상장 중견 게임기업 서울 강남구,"연봉 40,000,000원 - 70,000,000원","데이터 분석 결과를 쉽게 이해할 수 있도록 간결하고 명확한 의사전달 능력 [우대조건] * R, Python, Spark 등의 언어에 대한 이해도 * 모바일 앱SDK 연동 지원 업무 경험(Facebook, Admob..."
https://kr.indeed.com/viewjob?jk=212ca67d161b7162,2020 Market Data Analyst - Seoul (Korean Speaker),Bloomberg 서울,,"languages (e.g. Python, R, JavaScript... programming/scripting languages (e.g. Python, R, JavaScript, Java) as well as SQL..."
https://kr.indeed.com/viewjob?jk=e9e86127df39c006,[Search] 검색 서버 개발 & DevOps 엔지니어 신입/경력사원,네이버 서울,,"Linux 환경에서의 개발 경험이 있으신 분 · C++, Go, Python 등 하나 이상의 프로그래밍 언어로 서버 개발이 가능하신 분 · 컨테이... 으신 분 · C++, Go, Python 등 프로그래밍 언어에 하나 이상..."
https://kr.indeed.com/viewjob?jk=b9174b0547546861,안드로이드 앱개발 경력자 경력사원 (정규직),이퓨인터내셔널 서울 강남구,"연봉 30,000,000원 - 35,000,000원",앱스토어 출시 유경험자 Android의 경우 Kotlin 개발 경험자 Python 개발경험자 아이폰 (IOS) 개발역량 보유자 1 명 근무조건 고용형... 통신·모바일·게임>응용프로그래머> Python|인터넷·IT·통신·모바일·게임...
https://kr.indeed.com/viewjob?jk=37127548f83bb7f7,[Search] 네이버 웹검색 연구/개발 경력사원,네이버 서울,,러닝 패키지 중 한가지를 자신있게 활용할 수 있는 능력 • Linux에서의 개발작업이 익숙하며 Java/ Python/C++ 중 한가지 언어를 잘 다루는 능력 [우대사항] • 검색서비스의 수집/정제/랭킹개발업무 경력 • 포털...
https://kr.indeed.com/viewjob?jk=1961cdd73f62c880,"Specialized Solutions Architect III, Ana...",Amazon Web Services Korea LLC 서울,,"Knowledge... least one or more programing languages... Python, Java and Scala. · Hands on experience leading large..."
https://kr.indeed.com/viewjob?jk=0fd935a8c87c082e,20년 차량용 반도체/전장SW 전문가 경력 상시 [PT SW플랫폼 개발],현대오트론 서울 강남구,,"Ethernet, 엔진/변속기/하이브리드, 차량간 통신 등 차량 전장관련 경험·지식 · C/C++, JAVA, Python, Perl, Eclipse 등 언어 활용능력 · 영어 능통자 우대 서울 강남구 삼성동 지원조건 모집분..."
https://kr.indeed.com/viewjob?jk=b06176c3a7092e0a,Customer Facing Data Scientist,Ever Better Recruitment (EBR) 서울,,ensure appropriate communication Experience in R or Python analysis Up to 50% off-site visits English ability to perform...
https://kr.indeed.com/viewjob?jk=1b17d214a0d694f1,머신러닝기반 데이터분석_신입[4차],Success Korea 서울 선릉역,,"알고리즘 및 모델 연구개발 [자격요건] - 대졸 이상 - R 또는 Python을 활용한 데이터 처리 및 분석 프로젝트 경험 - 수학, 통계, 산업공... 자격요건 - 대졸 이상 - R 또는 Python을 활용한 데이터 처리 및..."
https://kr.indeed.com/viewjob?jk=882ce3f45214f1b1,Junior and/or Senior Engineers for MySQL...,Success Korea 서울,,5 years of work experience in C and Python programming ?Required Minimum of 5 years... experience in C and Python programming...
https://kr.indeed.com/viewjob?jk=8c8b1c8fee606a46,"Principal, Office365 SaaS Application En...",Coupang 3.1 서울,,"SQL, JavaScript, Python, etc.) 4+ years... IaaS 및 관련 기술 경험 C#, SQL, JavaScript, Python 등 일반 코딩 경험 기업 환경에서의 변경관리 경험 영어 가능자 모바일..."
https://kr.indeed.com/viewjob?jk=d498993697237b33,AI(인공지능) 개발자,휴먼디지털 서울,,를 활용한 Machine Learning(Deep Learning) 개발 경험자 우대 3. C/C++/C#/ Python 등 프로그래밍 경험자 우대 4. 분산시스템에 대한 이해가 있는 분 우대 근무지 서울 연봉 회사내규에따름...
https://kr.indeed.com/viewjob?jk=643ef4db65461d01,"[(주)데이터누리] Java 개발자 신입, 경력",데이터누리 서울 강서구,,및 Web App) 가능 Python 개발(System 및 Internet... 모바일·게임>응용프로그래머> Python|인터넷·IT·통신·모바일·게임>웹프로그래머>JAVA|인터넷·IT·통신·모바일·게임>웹프로그래머> Python
https://kr.indeed.com/viewjob?jk=16dff836029458af,"모바일 앱 서버 개발(Java, Python)",휴먼디지털 서울,,"Python) 자격조건 - 정보시스템 설계 및 데이터 마이닝용 시스템 설계. - 모바일 앱 서비스용 서버 API 설계 및 개발. - 주소록 동기화, Confirmed Push 경험 하신 분 우대. - 자바, Python..."
https://kr.indeed.com/viewjob?jk=f6e50a2c31a16f79,Imaging Scientist,Success Korea 경기도 화성,,"사용 가능 - OPC, LMC, Tachyon의 DRO 등 - Data analysis : Matlab, Python - Layout handling : Logic Library design 능력 우대 [전형절차] - 1차..."
https://kr.indeed.com/viewjob?jk=2e7b4cdaddc82b04,Surfacing,Mofac 서울 서초구,,"UV 매핑, 텍스쳐 과정 등 전과정에 대한 이해 – 타 파트와 긴밀한 협조 능력 우대사항 – Maya, Python 가능자 – Hair, Fur 작업 가능자 전형절차 서류전형 1차 실무면접 2차 임원면접 최종합격 서류전형..."
https://kr.indeed.com/viewjob?jk=f5db97b4d95cbc04,VP of Engineering,"Miso, inc 서울",,"분 제품을 전체적으로 리드할 수 있는 분 Golang, Node.js, Python, or Ruby 프로그래밍 언어 중 1개 이상 사용 가능하신 분... Data Science: Go, Python Collaboration..."
https://kr.indeed.com/viewjob?jk=9f7d7cbe5e172a01,Front-end Developer,"Miso, inc 서울",,"CSS, HTML에 대한 이해가 깊은 분 Golang, Node.js, Python, or Ruby 중 프로그래밍 언어 사용 가능하신 분 새로운 기술... Data Science: Go, Python Collaboration..."
https://kr.indeed.com/viewjob?jk=3d8e270a47a88295,DevOps Engineer,하이퍼커넥트 서울,,"유지하면서 production에 적용합니다. 지원자격 1년 이상의 Linux 계열 서버 관련 실무 경험 Python 등의 스크립트 언어를 이용한 코딩 능력 OS, 네트워크를 중심으로 하는 CS 전반에 걸친 기본적인 이해..."
https://kr.indeed.com/viewjob?jk=5995d15d597ea1f1,[Search] 클라우드 컴퓨팅 플랫폼 BE 개발 신입/경력사원,네이버 서울,,위한 기술 제안 [자격요건] · CS 관련 탄탄한 기본기를 바탕으로 습득이 빠르신 분 · Java / Python / C / C++ 중 1 개 이상의 언어로 개발 가능 · 리눅스 환경에서의 개발 경험 · 우수한 문제 분석...
https://kr.indeed.com/viewjob?jk=0b24eb0fb065a8d4,"음성인식 엔진개발( Kaldi, 서버 ) - 대기업",차량IT 전문 대기업 서울,,"서버개발) 2) OS: Linux, Language: C/C++ 또는 Java [우대사항] - Python 개발 가능자 - 머신러닝 이해 / 경험 - 대용량 트래픽 처리 경험자 - 네트워크 / Socket 프로그램..."
https://kr.indeed.com/viewjob?jk=2a1d77bd91952093,(주)엘솔루 개발자,㈜엘솔루 서울,,"필수사항] ㆍ프로그래밍에 재능 및 열정이 있는 자 ㆍJava, Python 중 하나 이상의 언어사용자 ㆍ자료구조 지식이 있는 자 ㆍ학력... 머신러닝(ML)|인터넷·IT·통신·모바일·게임>응용프로그래머> Python"
https://kr.indeed.com/viewjob?jk=79da9b878d3d8709,저축은행 다이랙트마케팅팀 데이터분석,국내자본 저축은행 서울 구로구,,"Insight 도출 업무 ex) R, Python 등 고급 분석 Tool을... 이상 우대) - 데이터사이언스, 컴퓨터공학, 수학/통계학 전공 - R/ Python 활용 중급 이상 *우대사항 : 데이터분석 관련 자격증(ADSP) 등..."
https://kr.indeed.com/viewjob?jk=7772fd53bc80acde,Senior Business Analyst (Retail Program...,Coupang 3.1 서울,,ecommerce or internet services business Experience with Python is a plus Experience with financial modeling/forecasting...
https://kr.indeed.com/viewjob?jk=32da80d36f2abbf2,Software Engineer - Machine Learning Pla...,PUBG 서울,,"GCP 등 클라우드 플랫폼에 대한 지식 및 사용 경험 - 최소 1가지 프로그래밍 언어를 능숙하게 사용: Python, Java, Scala, Go 등 - API 백엔드 설계 혹은 개발 혹은 운영해 본 경험 - Docker에..."
https://kr.indeed.com/viewjob?jk=bfdb6d14b38319a1,소프트웨어 개발 PM,SW개발전문회사 서울 목동,,"대졸 이상 - 웹 개발 경력 등 10년 이상 - 클라우드 서비스와 연계된 서비스를 개발 경험자 - Go, Python, JS(Angular/React) 등을 이용한 웹 애플리케이션 개발 경험자 우대 [전형절차] 서류, 면접..."
https://kr.indeed.com/viewjob?jk=8ae7c240ef7d5f0b,카카오 분석 플랫폼 경력 개발자,카카오 4.2 성남 판교역,,"플랫폼을 구축 지원자격 대용량 데이터에 대한 실시간/배치 서비스 개발 운영 경험이 있으신 분 python, scala, druid, hadoop 등 다양한 환경에 적응 가능한 분 어떤 일이라도 중요하게 여기며 책임감..."
https://kr.indeed.com/viewjob?jk=d0ad8d53ad979e23,Software Integration Engineer,Success Korea 서울,,"environment, Familiar with one of script language (Perl, Python or Shell) Good interpersonal skills; Strong knowledge..."
https://kr.indeed.com/viewjob?jk=407c2df519bda99a,[큐셀] 시스템개발팀 경력사원 (시스템개발팀 Embedded SW 개발자...,한화솔루션 서울 중구,,"및 구현 자격요건 - 관련 경력 5~8년 - 임베디드 Linux 시스템 개발 능력 보유자 - C/C++/ Python 언어 개발 능력 보유자 - IPC에 대한 높은 이해도 및 Porting 가능 자 (Shm, Dbus, MQ..."
https://kr.indeed.com/viewjob?jk=f59ae6a493eec795,"[R0001563] Principal, Back-end Engineer...",Coupang 3.1 서울,,"analysis) Computer Science Fundamentals 이수 Java, C++, C, Python, Scala 등 현대 프로그래밍 언어 중 최소 한 가지 이상을 능숙하게 활용할 수 있음 (본사에서는 주로..."
https://kr.indeed.com/viewjob?jk=d24428ed26f0b058,디지털LAB 신기술파트,국내자본 저축은행 서울 구로구,,"[담당업무] 쳇봇, STT/TA/TTS, AI 일반 [자격요건] 4년제 정규 대졸 이상 Java, Python 프로그램 사용 가능 머신러닝(Tensorflow, DL4, Caffe,Theano) 프레임워크 기반 개발 능력 보유..."
https://kr.indeed.com/viewjob?jk=7ab72b2f19e2425d,Back-end Engineer 경력 채용,주식회사 카사코리아 관심기업 서울 삼성동,,"클라이언트와 통신을 위한 API 설계 및 구현 [자격요건] - C++, JAVA, Node.js, Python, Go 중 하나 이상의 언어 능통자 - 프로덕션 환경에서 지속적인 서비스 개선 및 운영 경험 - 웹 기술 및..."
https://kr.indeed.com/viewjob?jk=35b6381bfc05576b,Server Engineering Manager,레이니스트 서울,,"8년 이상 서버 엔지니어링 경험 보유 1년 이상 팀 매니징 경험 보유 Golang/Java(Kotlin)/ Python 중 하나 이상에 전문성을 보유, 고도화된 서비스 설계 및 개발 경험 보유 다양한 도구 및 툴을 활용하여..."
https://kr.indeed.com/viewjob?jk=cdf617324298bb9d,저축은행 소비자금융 Data Science 팀,국내자본 저축은행 서울 구로구,,"4년제 정규 대졸 이상 - 통계, 수학, 산업공학 전공자 (석사 이상 우대) - 통계프로그램(SAS, R, Python) 활용가능자 - 소비자금융 CSS모델링 관련 업무 경력 2년 이상 [전형절차] 서류, 면접 2회 [제출서..."
https://kr.indeed.com/viewjob?jk=0df2999925f12355,Sr. Back-end Engineer (Query Understandi...,Coupang 3.1 서울,,"학사 학위 한 가지 혹은 그 이상의 범용 프로그래밍 언어 (Java, Python and C/C++)를 사용한 소프트웨어 개발 경험 MapReduce... languages (Java, Python and C/C++..."
https://kr.indeed.com/viewjob?jk=99e76e3ade272a0a,C / C++ for our CDN/ADN system Developer,Success Korea 서울,,"testing, and release ? Pluses: XML, Python, SQL, OpenSSL and various streaming... Pluses: XML, Python, SQL, OpenSSL..."
https://kr.indeed.com/viewjob?jk=2d7b16bcf6fa8c8f,Cloud Infrastructure (DevOps) Engineer,Sendbird 서울,,"e.g. Python) and automation skills... Unix/Linux systems Understanding of Python, Java, and Event-Driven Frameworks..."
https://kr.indeed.com/viewjob?jk=d3a7fde286f7954c,Backend Developer(Python or Java),Success Korea 서울,,"채용제목 Backend Developer( Python or Java) 회사소개 온라인 서비스 업무내용/자격요건 자격요건 - Python, Java, Ruby, Node.js 등을 사용한 3년 이상의 개발 경력 -Web..."
https://kr.indeed.com/viewjob?jk=80d3108dade97b0f,Back-end Developer,"Miso, inc 서울",,"이런 분과 함께하고 싶습니다] 백엔드 개발 경력 3년 이상 Ruby, Python, Go, Node.js 중 하나 이상의 언어에 능숙하신 분 새로운... Data Science: Go, Python Collaboration..."
https://kr.indeed.com/viewjob?jk=9439c6341fa5d45f,Senior Backend Developer,Calm Island 서울,,"skills in Korean or English Bonus Skills Experience with Python Experience with Redis, Memcached or similar Experience..."
https://kr.indeed.com/viewjob?jk=2cca42ee0951d4be,"Principal, Business Analysis (Coupang Ea...",Coupang 3.1 서울,,"SQL, Excel, Python, and R/SAS or any... 경영학 학사 혹은 해당 분야에서 그에 준하는 경험 SQL, Excel, Python, R/SAS 등 통계 분석용 소프트웨어 활용 경험 Hadoop..."
https://kr.indeed.com/viewjob?jk=b050bb34da9fface,"클라우드 Pre-Sales(기술영업) 전문인력 채용(책임/수석급 2명),...",주식회사 코어포인트 성남 분당구,"연봉 60,000,000원 - 100,000,000원","Windows 제품군에 대한 역량 보유자 - 기본적인 프로그래밍 개념 이해 (Shell, Powershell, Python 등) - WEB/WAS (Apache, Nginx, Tomcat, JBOSS, IIS 등) 운영 경험..."
https://kr.indeed.com/viewjob?jk=1947d9fed6bf4e36,백엔드 개발자(리드),Success Korea 서울 역삼역,,"법인 업무내용/자격요건 담당직무 Backend 개발 (node.js, python) 서비스 백엔드 시스템 개발 및 고객 및 광고 데이터를 처리합니다... TypeScript, Python ? Node.js, Express..."
https://kr.indeed.com/viewjob?jk=6ae76a6437a8a2b6,Solution Architecture: Starts-Up/Gaming,Success Korea 서울,,"modern development languages... Ruby, Python and Node.js - Experience working... languages... Ruby, Python and Node..."
https://kr.indeed.com/viewjob?jk=62f4835c89011cd6,Discovery(검색/추천) ML Engineer,Success Korea 서울,,"신만의 방법론을 보유하신 분 [우대사항] 자연어 처리, 랭킹 로직 및 추천 알고리즘 개발 경험이 있으신 분 Python 또는 R 등의 데이터를 다루기 위한 언어를 1 개 이상 능숙하게 사용 가능하신 분 수학 및 통계 이론을..."
https://kr.indeed.com/viewjob?jk=ec311e5136ff2c6e,Principal Business Analysis (Logistics S...,Coupang 3.1 서울,,"보유자 SQL, Excel, Python, R/SAS 혹은다른 통계 분석... who has experience with SQL, Excel, Python, and R/SAS or any statistical package..."
https://kr.indeed.com/viewjob?jk=891673055e77db43,머신러닝기반 데이터분석[2차],Success Korea 서울 선릉역,,"대졸 이상 - 통계학, 수학, 산업공학, 컴퓨터공학 전공 - R 또는 Python 사용경험 보유 [우대사항] - 석사/박사 학위 소지자 - 머신러닝... 공학, 컴퓨터공학 전공 - R 또는 Python 사용경험 보유 [우대사항..."
https://kr.indeed.com/viewjob?jk=4ae8dc6f5a02d1db,Data Scientist,해외송금 전문업체 서울 강남구,,"유지보수 - 데이터 시각화 [ 자격요건 ] - 경력 2~4년차 - SQL 사용이 능숙하신 분(필수) - R, Python 등을 이용한 분석 경험 [ 우대사항 ] - 빅데이터 및 금융데이터 분석 및 예측 - 통계학 전공자..."
https://kr.indeed.com/viewjob?jk=edb97f49613c2dd0,EEFA,Success Korea 인천 송도동,,"development, Embedded system engineering 경력 우대 - Firmware, Python, C programing 경험 우대 [전형절차] 서류전형, 인성검사, 면접전형(1차/2차), 건강검진..."
https://kr.indeed.com/viewjob?jk=d11342cfe074df78,Frontend Developer (Javascript/React),Bepro Company 서울,"연봉 30,000,000원 - 80,000,000원",참고 - React JS (Web) / Kotlin (Android) / Swift (iOS) - Python + Django - AWS lambda + API gateway - MySQL - Google Cloud...
https://kr.indeed.com/viewjob?jk=0010d13acf68cfe7,[Search] 분산 데이터 저장 플랫폼 BE 개발 신입/경력사원,네이버 서울,,"및 인터페이스 개발 [자격요건] · C S 관련 탄탄한 기본기를 바탕으로 습득이 빠르신 분 · Bash/ Python 중 1 개 , C/C++/Java 중 1 개 이상의 언어로 개발 가능 · 리눅스 환경에서 개발 경험 및..."
https://kr.indeed.com/viewjob?jk=074bbbc1b7c4d596,저축은행 디지털마케팅본부 데이터분석 경력자,국내자본 저축은행 서울 구로구,,"고객 분석, 마케팅 분석 - 마케팅 기획 및 실행조직과 협업 경험, 마케팅 데이터 모델링 개발능력 - R, Python, Tableau, SAS, Orange, SQL 등 데이터 분석의 업무를 수행 할 수 있는 개발 언어에..."
https://kr.indeed.com/viewjob?jk=0fea9598510abf0e,Effect Supervisor (경력 10년 이상) Effect Art...,Mofac 서울 서초구,,"후디니 사용자 – 이펙트 요소 표현에 뛰어난 감각 소유 – VFX 파이프라인에 대한 이해도 우대사항 – Python 등 Scripting 유경험자 – 외국어 가능자 (영어, 중국어) – 경력 5-10년 차 실무경력자 전형절..."
https://kr.indeed.com/viewjob?jk=c1037225077ca4da,데이터 분석가 (Business Intelligence Analyst),코스닥 상장 중견 게임기업 서울 강남구,"연봉 40,000,000원 - 70,000,000원","데이터 분석 결과를 쉽게 이해할 수 있도록 간결하고 명확한 의사전달 능력 [우대조건] * R, Python, Spark 등의 언어에 대한 이해도 * 모바일 앱SDK 연동 지원 업무 경험(Facebook, Admob..."
https://kr.indeed.com/viewjob?jk=53ced11b1e0addce,저축은행 디지털뱅킹팀 데이터분석 경력,국내자본 저축은행 서울 구로구,,"고객 분석, 마케팅 분석 - 마케팅 기획 및 실행조직과 협업 경험, 마케팅 데이터 모델링 개발능력 - R, Python, Tableau, SAS, Orange, SQL 등 데이터 분석의 업무를 수행 할 수 있는 개발 언어에..."
https://kr.indeed.com/viewjob?jk=ff2f8c996186ab4d,Cloud Application Architect - Profession...,Amazon Web Services Korea LLC 서울,,"any... following: Python, Java, Node... 테크니컬 어플리케이션 아키텍처로 대규모 어플리케이션 구축 현장경험 · Python, Java, Node.js, Ruby, .NET, Go, Scala..."
https://kr.indeed.com/viewjob?jk=c0f615c8aecd5778,Deep Learning Engineer(영상 처리),Success Korea 서울,,"resnet, r-cnn 등 주요 모델 지식 보유자 - C++, Python 능숙 사용자 우대사항 - 클라우드 환경 개발 경험 (Open stack... 모델 지식 보유자 - C++, Python 능숙 사용자 우대사항 - 클라..."
https://kr.indeed.com/viewjob?jk=04ecc7af1c61ab5a,통계 분석 전문가,Success Korea 서울 강서구,,"3. 실제 분석 경험 보유해야 함 (SAS, SPSS, or R, PYTHON) 4. 중급 이상을 원하나 초급도 상관없음 5. 빅데이터 인프라 및... SAS, SPSS, or R, PYTHON) 4. 중급 이상을 원하나 초급..."
https://kr.indeed.com/viewjob?jk=754348a9c3f08d66,Full Stack Developer,"Miso, inc 서울",,"이런 분과 함께하고 싶습니다] 개발 경력 3년 이상 Ruby, Python, Go, Node JS 중 하나 이상의 언어에 능숙하신 분 Ruby... Data Science: Go, Python Collaboration..."
https://kr.indeed.com/viewjob?jk=60c38beac39270b1,Full Stack Developer (Internal Products),Toss 서울 강남구,,"있는 분 # 우대 사항 - Python/Django 기반의 서비스 개발 경험이 있는 분 - React 개발 경험이 있는 분 - RDB 쿼리 최적화 경험이 있는 분 # 토스를 구성하는 기술 - Python, Django MTV..."
https://kr.indeed.com/viewjob?jk=528f6bfd19115fe1,웹개발자,매장공유기 서비스 서울,,"[담당 업무] -node.js/ python/react.js... 개발팀 사용 스펙(AWS, Typescript , node.js, python, mongo db, Linux)을 사용할 줄 아는 분 - 네트워크에..."
https://kr.indeed.com/viewjob?jk=35cefd4d91c7b366,저축은행 앱마케팅팀,국내자본 저축은행 서울 구로구,,Adbrix 등) - SQL 사용 가능 - 경력 3년~7년 - 개발자와의 원활한 커뮤니케이션 <우대사항> - Python or R 사용 우대 - 태블로 사용 우대 - Solution 도입 경험 우대 - 금융권 데이터 분석자...
https://kr.indeed.com/viewjob?jk=e51c8736967894d3,TEST IT,Success Korea 인천 부평구,,"전문기업 업무내용/자격요건 자격요건 - 전산 관련 학과 전공하신 분 - C/C++/C#, JAVA, Python, Unix/Linux, MSSQL 경력있으신 분 - 오픈소스 활용, 빅데이터 플랫폼 구축 및 운영 경험있..."
