ID,Title,Location,Salary,Summary
https://kr.indeed.com/viewjob?jk=bad0f76842269b46,[해외취업] 【AI・RPAエンジニア】経験半年の方も歓迎 10ヵ国の技術者が在...,株式会社リープ 대한민국,,"격요건 【必須要件】 ・何かしらのシステム開発経験が半年以上ある方 【歓迎要件】 ・Java, PHP, .NET, Pythonのスキルをお持ちの方 ・顧客折衝や要件定義などの上流工程経験がある方 ・RPAエンジニアとしての実務経験、知識がある方..."
https://kr.indeed.com/viewjob?jk=5e49f9d2a0120ab6,데이터 전문가 경력,LG CNS 3.7 서울,,"년 이상 ② R, Python, SQL 활용 가능 우대사항 (해당 내용 중 1개 이상) ① AI/빅데이터 분석 프로젝트 PM/PL 경험 보유 ② AI/빅데이터 분석 프로젝트 경험 10년 이상 ③ R, Python, SAS 중..."
https://kr.indeed.com/viewjob?jk=4cd34228af5013fd,DGIST 2019년 제1차 계약직원 공개채용 공고,대구경북과학기술원 대구 현풍면,,"우수자(SPSS, R 등 통계패키지) 외국어(영어) 구사 능력 우수자 Programming(MATLAB, Python, C/C++ 등) 가능자 · 근무기간 : 2019.3.11.~2020.3.10. ※ 단, 재계약 평가에..."
https://kr.indeed.com/viewjob?jk=06995d4800ce38f3,Field Application Engineer (FAE) – Korea...,LUCID Vision Labs 대한민국 • 재택 근무,,debugging technique (OpenCL... Python experience is a plus). In-depth knowledge... OpenCL... Python experience is a plus...
https://kr.indeed.com/viewjob?jk=06d03fe7addaa264,2020년도 IT기획팀 경력사원,한국다이이찌산쿄 서울 중구,,게임>빅데이터·AI(인공지능)> Python|인터넷·IT·통신·모바일·게임... 터넷·IT·통신·모바일·게임>웹프로그래머> Python|인터넷·IT·통신·모바일·게임>응용프로그래머> Python|인터넷·IT·통신·모바일·게임>응용프로...
https://kr.indeed.com/viewjob?jk=5fb443efe7acf5ab,데이터 분석가 영입,카카오모빌리티 성남 분당구,,"뤄보신 분 - Java, R, Python, Ruby 등 1개 이상의 주력... 모바일·게임>응용프로그래머> Python|인터넷·IT·통신·모바일·게임>웹프로그래머>JAVA|인터넷·IT·통신·모바일·게임>웹프로그래머> Python"
https://kr.indeed.com/viewjob?jk=747e809417b65ce3,Data Scientist (LINE TIMELINE),LINE Plus corporation 성남 서현역,,"Spark 등 대용량 데이터 처리 프레임워크에 대한 경험 - Python, R, SQL 등의 언어를 능숙하게 사용할 수 있는 능력 [우대사항... 원자 : '장애인증명서 또는 복지카드' 첨부 # Data # Python"
https://kr.indeed.com/viewjob?jk=7c3e870969914d57,글로벌 여행 스타트업 Trazy - 백엔드 개발자 (Python),트레이지(Trazy) 서울 중구,,"터베이스 설계, 쿼리튜닝을 포함한 DB 활용 능력 3. 우대조건 - Python, Django를 이용한 REST API 개발 경험 - DevOps 유... 통신·모바일·게임>웹프로그래머> Python|인터넷·IT·통신·모바일·게임..."
https://kr.indeed.com/viewjob?jk=ff52e5f9625f8f34,Machine Learning Engineer (LINE AI Servi...,LINE Plus corporation 성남 서현역,,"적용한 경험 - Hadoop MR, Hive, Spark 등 대용량 처리 프레임워크 개발/사용 경험 - Python, Scala, SQL 등의 프로그래밍 언어를 사용할 수 있는 분 - 해외 출장/근무에 결격 사유가 없는..."
https://kr.indeed.com/viewjob?jk=a427468a8c899737,[클라우드그램] 2020년 하반기 부문별,클라우드그램 서울 강남구,,"대 고객 프로젝트 리딩 경험 - Ansible, Chef, Puppet 등 인프라 자동화 도구 경험자 - Python, Ruby, Node.js 등 스크립트 가능자 Solutions Architect (AWS 부문) (경력3..."
https://kr.indeed.com/viewjob?jk=1748baa27965fdbf,"MVP 개발 엔지니어(서버, 웹프론트) (정규직, 계약직, 프리랜서)",더테스터 대전 중구,,1년 이상의 서버 개발 경험 · 아래 옵션 중 하나의 기술 스택 사용 - JAVA기반의 Spring - Python 기반의 Django - Ruby 기반의 Rails 우대사항 · 팀단위로 프로젝트를 수주해본 적 있는...
https://kr.indeed.com/viewjob?jk=4fa50f2ffd370bae,얼굴모션 캡처기술 인공지능(AI) 연구개발 전문기업,인공지능(AI) 연구개발 전문기업 경기도,,대한 이해 - Tensorflow/Pytorch 등 딥러닝 프레임워크에 대한 깊은 이해와 연구 개발 경험 보유 - Python/C++에 대한 능숙한 개발 경험 7) 우대사항 - 관련 분야 박사학위 소지자 - 인공지능(Deep...
https://kr.indeed.com/viewjob?jk=dbe87c84ae4d5ecb,(주)제이디솔루션 2020년도 상반기 개발부문,제이디솔루션 서울 금천구,,경험자 - 전기/전자/제어 전공자 및 신호 처리 경험자 - DSP(TI 및 ADSP 등) 개발 경험자 - Python / Matlab 등 시뮬레이션 툴 사용 가능 정규직 경력/신입 O명 신호처리 및 펌웨어 . 초음파/오디오...
https://kr.indeed.com/viewjob?jk=089931931a0474d5,소형전지사업부 경력,삼성SDI 3.9 충청남도 천안,,"천안 전공분야 - 컴퓨터/시스템 전자/전기 기계/산공 전문지식 - Java, C#, C++, Python - Orade (PL/SQL) - Automod, VisualComponent - 통신프로그래밍 경험자..."
https://kr.indeed.com/viewjob?jk=92bd400e3b5306ba,[Clova] Clova AI 인재,네이버 서울,,"산시스템 등 CS 핵심 전공 지식 관련한 수준 높은 이해 Git을 능숙하게 사용 백엔드 서버 구현 역량 ( Python, Golang, Java Spring, node.js 등) Mobile App 개발 Objective..."
https://kr.indeed.com/viewjob?jk=433ceb4487baf3dc,"Cyber Risk Management Analyst, Mid",Booz Allen Hamilton 경기도 평택,,Competitions — From programming competitions at our PyNights ( Python competition and learning events) to competing in CTFs...
https://kr.indeed.com/viewjob?jk=7af6301dc691d3ab,Data Scientist,Toss 서울 강남구,,"실무 경험 5년 이상 갖추신 분 - 실제 서비스 데이터를 이용한 분석모델 개발 경험이 있으신 분 - R, Python, Scala, SQL 등 데이터 분석의 업무를 수행할 수 있는 하나 이상의 개발 언어에 능숙하신 분 #..."
https://kr.indeed.com/viewjob?jk=3a3c48cd3026f062,[기술플랫폼실] 데이터 사이언티스트(Data Scientist) 분석가...,카카오페이 성남 분당구,,"능하신 분 - SQL 쿼리를 활용한 데이터 전처리/추출 가능하신 분 - Python, R 중 분석/모델 개발을 위한 숙달된 언어 보유하신 분 우대사항... 게임>빅데이터·AI(인공지능)> Python|인터넷·IT·통신·모바일·게임..."
https://kr.indeed.com/viewjob?jk=8925ce6bab9d00d6,바디모션 캡처기술 인공지능(AI) 연구개발 전문기업,인공지능(AI) 연구개발 전문기업 경기도,,대한 이해 - Tensorflow/Pytorch 등 딥러닝 프레임워크에 대한 깊은 이해와 연구 개발 경험 보유 - Python/C++에 대한 능숙한 개발 경험 7) 우대사항 - 관련 분야 박사학위 소지자 - 인공지능(Deep...
https://kr.indeed.com/viewjob?jk=d11342cfe074df78,Frontend Developer (Javascript/React),Bepro Company 서울,"연봉 30,000,000원 - 80,000,000원",참고 - React JS (Web) / Kotlin (Android) / Swift (iOS) - Python + Django - AWS lambda + API gateway - MySQL - Google Cloud...
https://kr.indeed.com/viewjob?jk=8c8700db243d1a3c,Applications Engineer (Library Character...,Synopsys 서울,,"Working knowledge of scripting languages like TCL, Unix Shell, Python, or Perl. Prior AE/design experience is a plus. Working..."
https://kr.indeed.com/viewjob?jk=01eb7001a0a614fb,2020년 하반기 (AI/딥러닝 알고리즘 설계/개발),씨젠 서울 송파구,,"설계 및 구현 경험 • R, Python 등 프로그래밍 언어 사용 능숙... 인공지능)> Python|인터넷·IT·통신·모바일·게임>응용프로그래머>인공지능(AI)|인터넷·IT·통신·모바일·게임>응용프로그래머> Python|인터넷..."
https://kr.indeed.com/viewjob?jk=8becbf73bbda7c96,2019 Military Service Exemption Position...,울산과학기술원 울산 언양읍,,"least one programming language... Fortran, C/C++, Python, …; Experience... managing high performance computational..."
https://kr.indeed.com/viewjob?jk=c388192aa3ac0634,Staff AE,Synopsys 서울,,"enhancement of advanced technology rule decks using TCL, Python or Perl. Key Qualification The person should have minimum 12..."
https://kr.indeed.com/viewjob?jk=36a418cd05c30a44,안드로이드 개발자,스포카 대한민국,,"합니다. 신기술 학습에 대한 열정 현재 스포카 크리에이터는 MSA기반의 서비스를 운영하고 있으며, 언어로는 Python, TypeScript, Rust, C#, Haskell, Kotlin 등 다양한 언어를 사용 중입니다..."
https://kr.indeed.com/viewjob?jk=c1037225077ca4da,데이터 분석가 (Business Intelligence Analyst),코스닥 상장 중견 게임기업 서울 강남구,"연봉 40,000,000원 - 70,000,000원","데이터 분석 결과를 쉽게 이해할 수 있도록 간결하고 명확한 의사전달 능력 [우대조건] * R, Python, Spark 등의 언어에 대한 이해도 * 모바일 앱SDK 연동 지원 업무 경험(Facebook, Admob..."
https://kr.indeed.com/viewjob?jk=8cc9b4c1f8813564,2020년 하반기 경력사원 (IT(Digital Transformatio...,LG상사 3.0 서울 종로구,,"경험(JavaScript, jQuery, Angular, Vue 등) 서버 개발 경험(PHP, ASP, Python, Node 등), 데이터베이스 개발 경험(SQL, SQLite, MongoDB 등), Git 활용 협업..."
https://kr.indeed.com/viewjob?jk=693772ef3f653d8d,"NAVER, LINE 서비스 플랫폼 운영",엔아이티서비스 성남 분당구,,"NAVER, LINE 서비스 플랫폼 운영 네이버/라인 서비스 플랫폼운영이란, 국내 및 해외를 포함하여 글로벌하게 제공되는 네이버/라인 서비스인 V앱, 파파고, 네이버클라우드플랫폼, 웨일, 네이버메인, 메일, 카페, 블로그..."
https://kr.indeed.com/viewjob?jk=6aac06e7339b28a5,[해외취업] AI/BI 엔지니어,유아솔류션즈 대한민국,,"고력과 도전적인 분 새로운 개발언어에 대한 적극적으로 습득의지가 강한 분 【우대스킬】 1) C/C++, Python,Perl 및 기타 프로그래밍 우대 2) 딥 러닝 도구(예:Tensorflow등등) 취급경력자 우대 3) AI..."
https://kr.indeed.com/viewjob?jk=97968c185e65d31a,Marketing Data Engineer,네오위즈 대한민국,,다양한 목적에 맞는 데이터웨어하우스 혹은 데이터마트 구축 가능) 3. 소통 능력이 뛰어나신 분 1. Python 혹은 Bash script로 배치 스크립트 작성이 가능하신 분 2. 다양한 데이터베이스의 구조 및 처리방식...
https://kr.indeed.com/viewjob?jk=1cf93daa6caae41a,[S/W] Data Scientist,현대자동차그룹 4.4 대한민국,,"경험 보유자 - 대규모, 실시간 데이터에 대한 데이터 분석, 처리, 시각화에 대한 경험 보유자 - Go, Python, C++ 등 하나 이상의 개발 언어를 능숙하게 사용할 수 있는 능력 보유자 우대사항 - 실서비스에서 데이터..."
https://kr.indeed.com/viewjob?jk=7fe3cefee1ec0993,연구소 개발부문 연구원 직원 (회로설계/하드웨어설계/머신비전/이미지프로세...,모든 경기도 광명,"연봉 40,000,000원 - 45,000,000원","프로그래밍 가능자 우대 S/W 설계 부문 : - OPEN CV, TENSORFLOW, YOLO, CUDA/ Python, C++, C WindowsGUL APL, MFC Lib 활용 가능자. 머신비전/ 영상처리 개발자 * 전기..."
https://kr.indeed.com/viewjob?jk=2bf26529770cdc22,"Analog Design Engr, Sr I",Synopsys 경기도 성남,,"simulation-control/data-capture. Experience with TCL, Perl, C, Python, MATLAB. Inclusion and Diversity are important to us..."
https://kr.indeed.com/viewjob?jk=41fbae1f0736eca8,일본 소프트웨어 엔지니어 연수과정 3기 (K-MOVE 해외취업),JMP KOREA 서울,,게임>빅데이터·AI(인공지능)> Python|인터넷·IT·통신·모바일·게임... 웹프로그래머> Python|인터넷·IT·통신·모바일·게임>응용프로그래머>증강현실(AR)|인터넷·IT·통신·모바일·게임>응용프로그래머> Python|인터넷...
https://kr.indeed.com/viewjob?jk=9a9e91ae6092ed2d,Developers,Coinplug 경기도 성남,,"development and operation Experience using Java / Node.js / Go / Python, etc. Ability to utilize Databases including RDB..."
https://kr.indeed.com/viewjob?jk=c1037225077ca4da,데이터 분석가 (Business Intelligence Analyst),코스닥 상장 중견 게임기업 서울 강남구,"연봉 40,000,000원 - 70,000,000원","데이터 분석 결과를 쉽게 이해할 수 있도록 간결하고 명확한 의사전달 능력 [우대조건] * R, Python, Spark 등의 언어에 대한 이해도 * 모바일 앱SDK 연동 지원 업무 경험(Facebook, Admob..."
https://kr.indeed.com/viewjob?jk=2cfd15907402c5cc,DGIST 제2차 계약직 연구원 채용공고,대구경북과학기술원 대구 현풍면,,천원 이내 수행 내용 Machine learning (Deep learning) 알고리즘 개발 Python/Tensorflow 프로그래밍 Matlab/simulink 모의실험 자율주행 자동차 혹은 전문 서비...
https://kr.indeed.com/viewjob?jk=d74aa20a454507fd,Analog Design Engineer(High-Speed Interf...,Synopsys 경기도 성남,,"simulation-control/data-capture. Experience with TCL, Perl, C, Python, MATLAB. Inclusion and Diversity are important to us..."
https://kr.indeed.com/viewjob?jk=05ce3c7d5c6c368c,Research Engineer - Machine Learning,AITRICS 서울,,learning approaches One or more software engineering skills ( Python preferred) Experience in using deep learning frameworks...
https://kr.indeed.com/viewjob?jk=bcd2f0630e298aa3,클라우드 인프라 운영 담당자 모집,넷마블 서울 구로구,,GCP) - 오픈소스 구축 및 운영 경험 보유자 - 게임사/포탈 인프라 운영 - 글로벌 서비스 운영 경험 - Python/Bash shell 역량 - Linux/Windows OS 구조 공학적 이해 - 기술적인 문제점 파악...
https://kr.indeed.com/viewjob?jk=b6a69d4f4e0a3017,네이버웹툰(주) AI 어플리케이션 엔지니어(경력) (상시),네이버 서울,,"분석 및 해결 능력이 뛰어나신 분 - 기술 습득이 빠르고 새로운 분야에 적응 할 수 있는 분 - Java, Python or C/C++등 하나 이상의 언어에 능숙하신 분 • 우대사항 - 머신러닝 서빙 개발 경험이 있으신 분..."
https://kr.indeed.com/viewjob?jk=212ca67d161b7162,2020 Market Data Analyst - Seoul (Korean Speaker),Bloomberg 서울,,"languages (e.g. Python, R, JavaScript... programming/scripting languages (e.g. Python, R, JavaScript, Java) as well as SQL..."
https://kr.indeed.com/viewjob?jk=d56db98820a1324c,스크립트 개발 프로그래머,Nexon 성남 분당구,,"JavaScript 및 기타(Lua, Python) 스크립트 엔진 연동... 대한 이해가 있고, IL을 수정하여 개발이 가능한 분 - Lua, Python 등 다른 스크립트 언어에 대한 이해가 깊고 능숙하게 사용 가능한 분..."
https://kr.indeed.com/viewjob?jk=25725b3c0e607311,Junior Quant Trader,Byzantine Partners 서울,,background is a plus Programming capability is mandatory (i.e. Python) Understanding of machine learning algorithm is a plus...
https://kr.indeed.com/viewjob?jk=ffac42e32db26233,Lead Product Engineer - Liberate,Cadence Design Systems 경기도,,"problems and propose solution Automation skills using Tcl, Python, Perl and shell scripting Bachelor/Master in EE with 5+..."
https://kr.indeed.com/viewjob?jk=1a75ce748c5f24e9,TOAST CAM 임베디드 개발,NHN 4.4 성남 판교역,,"또는 석사 학위 또는 그에 준하는 실무 경험자 (신입 지원가능) - 임베디드 환경에서 영상 처리 경험자 - Python, C++ 개발 경험 - 딥러닝 프레임워크, 컴퓨터 비젼 경험자 - Visual Object..."
https://kr.indeed.com/viewjob?jk=fb84164a9eed9423,Junior Full-stack Developer,Asiance 서울,,"React 혹은 WordPress 등의 CMS도 사용. • Python, Node.js, Java, PHP for backend development. • Python, Node.js, Java, PHP 등을 사용하여 백엔드..."
https://kr.indeed.com/viewjob?jk=07a8bb63e26d141c,딥러닝 알고리즘 및 응용 Engineer,딥엑스 성남 분당구,"연봉 40,000,000원 - 99,990,000원",게임>빅데이터·AI(인공지능)>tensorflow|인터넷·IT·통신·모바일·게임>빅데이터·AI(인공지능)> Python|인터넷·IT·통신·모바일·게임>빅데이터·AI(인공지능)>머신러닝|인터넷·IT·통신·모바일·게임>응용프로그래...
https://kr.indeed.com/viewjob?jk=a358a39da5dfc360,[NAVERxLINE] Global Ad AI Engineer/AI Pl...,네이버 서울,,"learn, Tensorflow, PyTorch, MXNet 등 오픈소스 프레임워크 기반 개발 가능하신 분 - Python, Java, Scala 중 1개 이상의 언어를 활용한 소프트웨어 개발 역량 - 논문 습득, 이해 및..."
https://kr.indeed.com/viewjob?jk=a746de9c7a6168ef,Healthcare Real World Data Analyst 담당자,IQVIA 서울,,"HEOR 전반적인 업무 수행 Qualifications Claims Data 관련 분석 경력자 SAS / Python / R 등 통계 프로그래밍 언어 사용 가능자 통계학 전공자, 통계 및 Epidemiology 관련 석사..."
https://kr.indeed.com/viewjob?jk=a57f408f00946723,[메가존] 오라클 클라우드 아키텍트,메가존 서울 강남구,,JAVA|인터넷·IT·통신·모바일·게임>응용프로그래머> Python|인터넷·IT·통신·모바일·게임>웹프로그래머>JAVA|인터넷·IT·통신·모바일·게임>웹프로그래머> Python|인터넷·IT·통신·모바일·게임>데이터베이스·DBA>NoSQL
https://kr.indeed.com/viewjob?jk=fb097f960762428c,2020 연구/개발 공개(영상처리),인바디 서울 강남구,,모바일·게임>웹프로그래머> Python|인터넷·IT·통신·모바일·게임>응용프로그래머> Python|인터넷·IT·통신·모바일·게임>응용프로그래머>C·C++|인터넷·IT·통신·모바일·게임>빅데이터·AI(인공지능)> Python|전자...
https://kr.indeed.com/viewjob?jk=d5be40de21d8637a,Senior Field Service Engineer,Huntington Ingalls Industries Inc. 경기도 평택,,"Technical background with working knowledge of HTML, Ruby, Python... Java Knowledge of hardware, networks, and server..."
https://kr.indeed.com/viewjob?jk=212d5a9db145fc34,[NHN godo] 인프라 플랫폼 개발자,엔에이치엔고도 서울 구로구,,"이하 - PHP(주 개발언어), Python, Java 중 하나 이상 개발... 프로그래머> Python|인터넷·IT·통신·모바일·게임>웹프로그래머>JAVA|인터넷·IT·통신·모바일·게임>응용프로그래머> Python|인터넷·IT·통신..."
https://kr.indeed.com/viewjob?jk=efc85245dd33a3aa,Bigdata Engineer 신입/ 경력직,SK인포섹 2.9 성남 분당구,,"배치 서비스 운영 경험자 - Linux 시스템 사용 경험자 - 프로그램 개발 (Java, Scala, Python) 기술 보유자 ※ 모든 전형은 합격자에 한해 개별발표 진행함. 전형절차 - 경력 : 서류전형 SKCT(심층..."
https://kr.indeed.com/viewjob?jk=f281c810daf0e10d,카카오 네트워크 엔지니어,카카오 4.2 성남 판교역,,"있는 자신감 넘치시는 분 (기술, 응대 모든 면에서) 해외여행 결격사유 없는 분 선호 자격 bash, python 등을 이용한 인프라 관리 자동화 스크립트 가능하신 분 인프라 운영 및 관리 관련 Tool 개발/경험이 있으..."
https://kr.indeed.com/viewjob?jk=ae406e8ca03c5d67,IC 설계자동화(EDA) 소프트웨어 아날로그/혼성신호 모델 개발자 신입사...,사이언티픽아날로그랩스 서울 서초구,"연봉 36,000,000원 - 48,000,000원",프로그래밍 및 시뮬레이션/검증 경험 있는 분 우대 인터넷·IT·통신·모바일·게임>응용프로그래머>Linux|인터넷·IT·통신·모바일·게임>웹프로그래머> Python|전자·기계·기술·화학·연구개발>연구원·연구개발>전기·전자
https://kr.indeed.com/viewjob?jk=3d0fef92805a8c7c,[서울지사] 데이터 분석가,네오플 서울 강남구,,"분석해보고 싶은 주제와 방법론'이 있는 분 - 수학/통계 및 알고리즘에 대한 이해 및 활용 능력 - R, Python 등 자신에게 익숙한 툴을 활용한 데이터 가공 능력 - Word, Excel, PPT 활용능력 - 우수한..."
https://kr.indeed.com/viewjob?jk=3df9dee441bb4e19,"IT Project Manager, E-Commerce",Procter & Gamble 4.2 서울,,system integrations Programming skills (e.g. C++/Java/ Python... ability to read and write SQL Business Analytics skills...
https://kr.indeed.com/viewjob?jk=1cf825d234463890,[피파온라인4] 소프트웨어 엔지니어,Electronic Arts 서울,,관련 논문 및 자료를 이해할 수 있는 영어 능력 keras... tensorflow 사용경험 python을 이용한 코딩 경험 [ 우대 사항 ] Machine Learning 관련 논문을 구현해본 경험 (졸업 작품...
https://kr.indeed.com/viewjob?jk=b574f1454ae36aab,Cross Border Ecommerce - Business Intell...,Shopee 서울,,business analyst related roles Proficient in SQL and Python Strong analytical skill and sensitivity to data Strong oral...
https://kr.indeed.com/viewjob?jk=a58c48ff1cf0ac4d,[포티투마루] 전문연구요원 병역특례 인공지능 개발자,포티투마루 서울 관악구,,인터넷·IT·통신·모바일·게임>응용프로그래머>머신러닝(ML)|인터넷·IT·통신·모바일·게임>응용프로그래머> Python|인터넷·IT·통신·모바일·게임>웹프로그래머>백엔드|인터넷·IT·통신·모바일·게임>웹프로그래머>프론트엔드...
https://kr.indeed.com/viewjob?jk=c0410531767c0b41,[대형보험사] 변액헤지 담당 (대리~차장급),커리어라임즈 서울,,"이상 (필수) - 금융공학 관련 지식, 프로그래밍 역량(C++,C#, Python,VBA,DB 등) (필수) - CFA, FRM 등(우대) 커리어라임즈... 지식, 프로그래밍 역량(C++,C#, Python,VBA,DB 등) (필수..."
https://kr.indeed.com/viewjob?jk=1215068d0a18f818,[2020년 수도권 혁신기업 온라인 박람회](주)백스테이션,백스테이션 서울 성동구,,"및 유지보수 - API 데이터 문자열 파싱 - 데이터 수집 자동화 설계 자격요건 - Java, C/C++, Python, Rust 등을 이용한 웹 크롤러 개발 경력 - 상기 언어에 대해 최소 1년 이상 개발 경험 - 웹 서비..."
https://kr.indeed.com/viewjob?jk=2974a8f287becde6,Technical Customer Support Engineer (Kor...,Univa Corporation 서울,,"Shell scripting (bourne, bash, other unix shells) and Python. Experience in Perl and C/C++ would be a nice to have. Knowledge..."
https://kr.indeed.com/viewjob?jk=d1e75364ef505c68,"데이터 가치 함께 발굴하실 머신러닝, 통계 모델링 전문가",카카오 4.2 성남 판교역,,해당 기술에 자신감이 있으신 분도 환영합니다. 지원자격 머신 러닝/통계 등 모델링에 활용하는 언어( Python/Scala/R 등) 및 도구(Tensor flow/Pytorch 등)를 하나 이상 능숙하게 다룰 수 있으신...
https://kr.indeed.com/viewjob?jk=e5ca14de265f7fc9,Data Analyst,레이니스트 서울,,"가지신 분 Business Intelligence 시스템 및 비즈니스 리포팅 툴의 활용 능력 프로그래밍 언어( Python/R, etc)를 활용하여 데이터 분석이 가능하신 분 더 나은 데이터 기반 서비스를 만들기 위해 동료들과..."
https://kr.indeed.com/viewjob?jk=aff0827cf77a81ca,2020년 (주)알앤비소프트 상반기 신입/경력 사원,알앤비소프트웨어 성남 분당구,,통신·모바일·게임>웹프로그래머> Python|인터넷·IT·통신·모바일·게임... 용프로그래머>자바스크립트|인터넷·IT·통신·모바일·게임>응용프로그래머> Python|무역·영업·판매·매장관리>기술영업>IT서비스·웹사이트구축|무역·영업...
https://kr.indeed.com/viewjob?jk=de567c4b6b588c4c,NAVER IDC 서버 운영/관리(춘천),NIT Service 춘천 동면,,"Web, WAS에 대한 지식과 System application 운영 경험 - Shell script, python 활용 가능 - 해외 데이터센터 인프라 구축 또는 운영 경험 [고용형태] - 정규직 [근무지역] - 춘천..."
https://kr.indeed.com/viewjob?jk=5acb25fbadac77bb,[LINE BIZ PLUS] FDS 서버 개발,라인비즈플러스 성남 분당구,,"개발 경험 - java, python 중 하나 이상 언어에 익숙한 자... 모바일·게임>응용프로그래머> Python|인터넷·IT·통신·모바일·게임>웹프로그래머>JAVA|인터넷·IT·통신·모바일·게임>웹프로그래머> Python"
https://kr.indeed.com/viewjob?jk=96beffb2c2c358cc,시스템개발팀 경력사원,한화솔루션 서울 중구,,년 - 임베디드 Linux 시스템 개발 능력 보유자 - C/C++/ Python 언어 개발 능력 보유자 - IPC에 대한 높은 이해도 및 Porting... learning 개발경험 보유자 - Python (C/C++) 언어 개발...
https://kr.indeed.com/viewjob?jk=b83e48f219011128,매칭팀 - 프로그래머,Nexon 성남 분당구,,"상의 서비스 개발과 운영 - 게임 매치메이킹, 추천 시스템 개발 지원자격 - 한 가지 이상의 개발 언어( Python, C++, C#, Go 등)에 숙련된 프로그래밍 능력 우대사항 - 게임 개발 또는 라이브 서비스 경험이..."
https://kr.indeed.com/viewjob?jk=530a598184580c95,데스크탑 가상화(VDI) 엔지니어,카카오 4.2 성남 판교역,,"기본적 이해 리눅스 시스템에 대한 기본적 이해 우대사항 시스템 엔지니어 경력자 Powershell, Python, Shell 스크립트를 이용한 인프라 관리 자동화 경험자 부드러운 커뮤니케이션, 친절한 마인드의 소유자..."
https://kr.indeed.com/viewjob?jk=973c3d7f651d0313,Machine Learning 엔지니어 영입,카카오모빌리티 성남 분당구,,"다룰 수 있는 분 ※ 언어 : Python[필수], Scala, R 등... 터넷·IT·통신·모바일·게임>웹프로그래머> Python|인터넷·IT·통신·모바일·게임>응용프로그래머> Python|마케팅·광고·홍보·조사>조사·분석·통계..."
